{
    "schemaVersion":  1,
    "locale":  "zh-CN",
    "source":  "docs/design/Minecraft_Biome_Rivals_Prototype_Cards_v0.1.md",
    "entries":  [
                    {
                        "id":  "pf_001",
                        "designId":  "PF-001",
                        "nameKey":  "card.pf_001.name",
                        "name":  "蜜蜂",
                        "collectible":  true
                    },
                    {
                        "id":  "pf_002",
                        "designId":  "PF-002",
                        "nameKey":  "card.pf_002.name",
                        "name":  "放牧绵羊",
                        "collectible":  true
                    },
                    {
                        "id":  "pf_003",
                        "designId":  "PF-003",
                        "nameKey":  "card.pf_003.name",
                        "name":  "驯服的狼",
                        "collectible":  true
                    },
                    {
                        "id":  "pf_004",
                        "designId":  "PF-004",
                        "nameKey":  "card.pf_004.name",
                        "name":  "村民农夫",
                        "collectible":  true
                    },
                    {
                        "id":  "pf_005",
                        "designId":  "PF-005",
                        "nameKey":  "card.pf_005.name",
                        "name":  "林地苗圃",
                        "collectible":  true
                    },
                    {
                        "id":  "pf_006",
                        "designId":  "PF-006",
                        "nameKey":  "card.pf_006.name",
                        "name":  "繁殖季节",
                        "collectible":  true
                    },
                    {
                        "id":  "pf_007",
                        "designId":  "PF-007",
                        "nameKey":  "card.pf_007.name",
                        "name":  "林间集结",
                        "collectible":  true
                    },
                    {
                        "id":  "pf_008",
                        "designId":  "PF-008",
                        "nameKey":  "card.pf_008.name",
                        "name":  "铁傀儡",
                        "collectible":  true
                    },
                    {
                        "id":  "db_001",
                        "designId":  "DB-001",
                        "nameKey":  "card.db_001.name",
                        "name":  "尸壳",
                        "collectible":  true
                    },
                    {
                        "id":  "db_002",
                        "designId":  "DB-002",
                        "nameKey":  "card.db_002.name",
                        "name":  "可疑的沙子",
                        "collectible":  true
                    },
                    {
                        "id":  "db_003",
                        "designId":  "DB-003",
                        "nameKey":  "card.db_003.name",
                        "name":  "沙漠考古学家",
                        "collectible":  true
                    },
                    {
                        "id":  "db_004",
                        "designId":  "DB-004",
                        "nameKey":  "card.db_004.name",
                        "name":  "仙人掌围栏",
                        "collectible":  true
                    },
                    {
                        "id":  "db_005",
                        "designId":  "DB-005",
                        "nameKey":  "card.db_005.name",
                        "name":  "恶地劫掠者",
                        "collectible":  true
                    },
                    {
                        "id":  "db_006",
                        "designId":  "DB-006",
                        "nameKey":  "card.db_006.name",
                        "name":  "沙尘暴",
                        "collectible":  true
                    },
                    {
                        "id":  "db_007",
                        "designId":  "DB-007",
                        "nameKey":  "card.db_007.name",
                        "name":  "沙漠神殿",
                        "collectible":  true
                    },
                    {
                        "id":  "db_008",
                        "designId":  "DB-008",
                        "nameKey":  "card.db_008.name",
                        "name":  "商队领头骆驼",
                        "collectible":  true
                    },
                    {
                        "id":  "si_001",
                        "designId":  "SI-001",
                        "nameKey":  "card.si_001.name",
                        "name":  "雪球",
                        "collectible":  true
                    },
                    {
                        "id":  "si_002",
                        "designId":  "SI-002",
                        "nameKey":  "card.si_002.name",
                        "name":  "雪傀儡",
                        "collectible":  true
                    },
                    {
                        "id":  "si_003",
                        "designId":  "SI-003",
                        "nameKey":  "card.si_003.name",
                        "name":  "流浪者",
                        "collectible":  true
                    },
                    {
                        "id":  "si_004",
                        "designId":  "SI-004",
                        "nameKey":  "card.si_004.name",
                        "name":  "山羊",
                        "collectible":  true
                    },
                    {
                        "id":  "si_005",
                        "designId":  "SI-005",
                        "nameKey":  "card.si_005.name",
                        "name":  "北极熊",
                        "collectible":  true
                    },
                    {
                        "id":  "si_006",
                        "designId":  "SI-006",
                        "nameKey":  "card.si_006.name",
                        "name":  "粉雪桶",
                        "collectible":  true
                    },
                    {
                        "id":  "si_007",
                        "designId":  "SI-007",
                        "nameKey":  "card.si_007.name",
                        "name":  "雪屋",
                        "collectible":  true
                    },
                    {
                        "id":  "si_008",
                        "designId":  "SI-008",
                        "nameKey":  "card.si_008.name",
                        "name":  "冰刺之巅",
                        "collectible":  true
                    },
                    {
                        "id":  "cd_001",
                        "designId":  "CD-001",
                        "nameKey":  "card.cd_001.name",
                        "name":  "洞穴蝙蝠",
                        "collectible":  true
                    },
                    {
                        "id":  "cd_002",
                        "designId":  "CD-002",
                        "nameKey":  "card.cd_002.name",
                        "name":  "洞穴蜘蛛",
                        "collectible":  true
                    },
                    {
                        "id":  "cd_003",
                        "designId":  "CD-003",
                        "nameKey":  "card.cd_003.name",
                        "name":  "地牢骷髅",
                        "collectible":  true
                    },
                    {
                        "id":  "cd_004",
                        "designId":  "CD-004",
                        "nameKey":  "card.cd_004.name",
                        "name":  "幽匿感测体",
                        "collectible":  true
                    },
                    {
                        "id":  "cd_005",
                        "designId":  "CD-005",
                        "nameKey":  "card.cd_005.name",
                        "name":  "林地卫道士",
                        "collectible":  true
                    },
                    {
                        "id":  "cd_006",
                        "designId":  "CD-006",
                        "nameKey":  "card.cd_006.name",
                        "name":  "回响的黑暗",
                        "collectible":  true
                    },
                    {
                        "id":  "cd_007",
                        "designId":  "CD-007",
                        "nameKey":  "card.cd_007.name",
                        "name":  "废弃矿井",
                        "collectible":  true
                    },
                    {
                        "id":  "cd_008",
                        "designId":  "CD-008",
                        "nameKey":  "card.cd_008.name",
                        "name":  "林地府邸",
                        "collectible":  true
                    },
                    {
                        "id":  "or_001",
                        "designId":  "OR-001",
                        "nameKey":  "card.or_001.name",
                        "name":  "鲑鱼群",
                        "collectible":  true
                    },
                    {
                        "id":  "or_002",
                        "designId":  "OR-002",
                        "nameKey":  "card.or_002.name",
                        "name":  "海豚向导",
                        "collectible":  true
                    },
                    {
                        "id":  "or_003",
                        "designId":  "OR-003",
                        "nameKey":  "card.or_003.name",
                        "name":  "溺尸",
                        "collectible":  true
                    },
                    {
                        "id":  "or_004",
                        "designId":  "OR-004",
                        "nameKey":  "card.or_004.name",
                        "name":  "守卫者",